[
  {
    "service_id": "svc-001",
    "service_name": "mariner-edge-gateway",
    "environment": "prod",
    "waiver_type": "none",
    "waiver_status": "none",
    "waiver_scope": null,
    "waiver_expires_on": null,
    "cert_fingerprint": "ED:43:3C:9A:CC:BD:2F:46:ED:7D:FF:1E:AE:88:37:B0:FD:12:56:9E:A6:C5:FB:E1:CF:E4:79:AA:E4:51:F9:4C",
    "cert_not_after": "2026-11-20",
    "cert_key_algo": "RSA",
    "cert_key_bits": 2048,
    "cert_issuer": "Mariner Internal CA G2",
    "probe_tls_version": "TLS1.3",
    "probe_verify_ok": false,
    "probe_mtls_required": true,
    "probe_mtls_presented": true,
    "probe_chain_valid": true,
    "probe_http_status": 200,
    "probe_observed_fingerprint": "CF:66:9E:7C:4E:15:FA:91:34:8E:C0:E0:91:22:7F:AD:D7:7F:72:CE:D2:BE:7F:93:9D:FE:6A:F2:88:79:9F:42"
  },
  {
    "service_id": "svc-002",
    "service_name": "mariner-auth-broker",
    "environment": "staging",
    "waiver_type": "tls",
    "waiver_status": "granted",
    "waiver_scope": "all",
    "waiver_expires_on": "2026-12-01",
    "cert_fingerprint": "CD:69:E3:FB:48:71:75:79:E1:48:B7:0A:DD:8F:21:79:21:67:55:6E:32:BF:03:47:2B:91:BB:E4:E4:CA:88:B8",
    "cert_not_after": "2027-01-10",
    "cert_key_algo": "RSA",
    "cert_key_bits": 2048,
    "cert_issuer": "Mariner Internal CA G2",
    "probe_tls_version": "TLS1.2",
    "probe_verify_ok": false,
    "probe_mtls_required": false,
    "probe_mtls_presented": false,
    "probe_chain_valid": true,
    "probe_http_status": 200,
    "probe_observed_fingerprint": "AC:93:F9:A7:E6:F2:64:5C:4C:66:54:39:60:9C:15:83:19:52:4D:A7:65:C4:ED:6A:37:3D:32:10:3E:42:38:C6"
  },
  {
    "service_id": "svc-003",
    "service_name": "mariner-billing-api",
    "environment": "prod",
    "waiver_type": "tls",
    "waiver_status": "granted",
    "waiver_scope": "all",
    "waiver_expires_on": "2026-05-01",
    "cert_fingerprint": "0E:82:15:9D:B3:A1:F1:0B:11:9E:78:E9:F5:BA:8A:3D:4C:AD:B0:25:74:AA:64:EC:05:E0:11:14:32:27:09:6A",
    "cert_not_after": "2026-12-05",
    "cert_key_algo": "RSA",
    "cert_key_bits": 2048,
    "cert_issuer": "Mariner Public CA R3",
    "probe_tls_version": "TLS1.0",
    "probe_verify_ok": false,
    "probe_mtls_required": true,
    "probe_mtls_presented": true,
    "probe_chain_valid": true,
    "probe_http_status": 200,
    "probe_observed_fingerprint": "0E:82:15:9D:B3:A1:F1:0B:11:9E:78:E9:F5:BA:8A:3D:4C:AD:B0:25:74:AA:64:EC:05:E0:11:14:32:27:09:6A"
  },
  {
    "service_id": "svc-004",
    "service_name": "mariner-fulfillment",
    "environment": "prod",
    "waiver_type": "mtls",
    "waiver_status": "granted",
    "waiver_scope": "prod",
    "waiver_expires_on": "2026-04-30",
    "cert_fingerprint": "79:9C:C8:7F:5C:F9:77:3D:4B:E1:90:1E:F4:8D:12:02:76:DA:0C:51:6C:75:67:B8:44:C6:8E:AA:2E:5B:D2:E1",
    "cert_not_after": "2026-10-30",
    "cert_key_algo": "EC",
    "cert_key_bits": 256,
    "cert_issuer": "Mariner Internal CA G2",
    "probe_tls_version": "TLS1.2",
    "probe_verify_ok": true,
    "probe_mtls_required": true,
    "probe_mtls_presented": false,
    "probe_chain_valid": true,
    "probe_http_status": 200,
    "probe_observed_fingerprint": "79:9C:C8:7F:5C:F9:77:3D:4B:E1:90:1E:F4:8D:12:02:76:DA:0C:51:6C:75:67:B8:44:C6:8E:AA:2E:5B:D2:E1"
  },
  {
    "service_id": "svc-005",
    "service_name": "mariner-telemetry",
    "environment": "prod",
    "waiver_type": "chain",
    "waiver_status": "revoked",
    "waiver_scope": "all",
    "waiver_expires_on": "2026-09-01",
    "cert_fingerprint": "E3:EE:9D:66:7E:8A:38:3D:0D:EB:66:AC:FC:A4:EB:1F:18:AA:95:1C:85:7B:F4:20:22:B7:1C:BB:72:0B:57:24",
    "cert_not_after": "2026-11-01",
    "cert_key_algo": "RSA",
    "cert_key_bits": 4096,
    "cert_issuer": "DigiCert Global G3",
    "probe_tls_version": "TLS1.2",
    "probe_verify_ok": false,
    "probe_mtls_required": true,
    "probe_mtls_presented": true,
    "probe_chain_valid": false,
    "probe_http_status": 200,
    "probe_observed_fingerprint": "E3:EE:9D:66:7E:8A:38:3D:0D:EB:66:AC:FC:A4:EB:1F:18:AA:95:1C:85:7B:F4:20:22:B7:1C:BB:72:0B:57:24"
  },
  {
    "service_id": "svc-006",
    "service_name": "mariner-config-service",
    "environment": "prod",
    "waiver_type": "tls",
    "waiver_status": "revoked",
    "waiver_scope": "all",
    "waiver_expires_on": "2026-08-01",
    "cert_fingerprint": "2F:7C:87:17:B2:C2:C9:EA:67:2E:3D:63:91:8F:DB:25:4B:F1:F5:28:29:DC:ED:AE:25:D5:1A:51:BB:26:26:E4",
    "cert_not_after": "2026-12-20",
    "cert_key_algo": "RSA",
    "cert_key_bits": 2048,
    "cert_issuer": "Mariner Internal CA G2",
    "probe_tls_version": "TLS1.0",
    "probe_verify_ok": false,
    "probe_mtls_required": true,
    "probe_mtls_presented": true,
    "probe_chain_valid": true,
    "probe_http_status": 200,
    "probe_observed_fingerprint": "2F:7C:87:17:B2:C2:C9:EA:67:2E:3D:63:91:8F:DB:25:4B:F1:F5:28:29:DC:ED:AE:25:D5:1A:51:BB:26:26:E4"
  },
  {
    "service_id": "svc-007",
    "service_name": "mariner-search-index",
    "environment": "prod",
    "waiver_type": "none",
    "waiver_status": "none",
    "waiver_scope": null,
    "waiver_expires_on": null,
    "cert_fingerprint": "56:1A:A8:BD:10:83:BB:B6:70:A8:FD:D9:52:C9:6D:8C:A9:CE:42:78:29:8D:19:17:5C:4D:37:43:AA:7E:29:FD",
    "cert_not_after": "2027-02-01",
    "cert_key_algo": "RSA",
    "cert_key_bits": 2048,
    "cert_issuer": "Mariner Public CA R3",
    "probe_tls_version": "TLS1.0",
    "probe_verify_ok": false,
    "probe_mtls_required": true,
    "probe_mtls_presented": true,
    "probe_chain_valid": true,
    "probe_http_status": 200,
    "probe_observed_fingerprint": "56:1A:A8:BD:10:83:BB:B6:70:A8:FD:D9:52:C9:6D:8C:A9:CE:42:78:29:8D:19:17:5C:4D:37:43:AA:7E:29:FD"
  },
  {
    "service_id": "svc-008",
    "service_name": "mariner-dev-sandbox",
    "environment": "dev",
    "waiver_type": "none",
    "waiver_status": "none",
    "waiver_scope": null,
    "waiver_expires_on": null,
    "cert_fingerprint": "8D:EF:0F:D6:13:9A:08:BD:87:97:87:C0:A4:30:94:62:6F:A0:E9:75:30:46:32:B4:81:B7:1B:8C:AB:86:28:53",
    "cert_not_after": "2027-03-01",
    "cert_key_algo": "RSA",
    "cert_key_bits": 2048,
    "cert_issuer": "Mariner Internal CA G2",
    "probe_tls_version": "TLS1.0",
    "probe_verify_ok": false,
    "probe_mtls_required": false,
    "probe_mtls_presented": false,
    "probe_chain_valid": true,
    "probe_http_status": 200,
    "probe_observed_fingerprint": "8D:EF:0F:D6:13:9A:08:BD:87:97:87:C0:A4:30:94:62:6F:A0:E9:75:30:46:32:B4:81:B7:1B:8C:AB:86:28:53"
  },
  {
    "service_id": "svc-009",
    "service_name": "mariner-payments-gw",
    "environment": "prod",
    "waiver_type": "none",
    "waiver_status": "none",
    "waiver_scope": null,
    "waiver_expires_on": null,
    "cert_fingerprint": "1F:DB:4A:C1:0F:11:1A:E5:20:47:E0:7E:65:10:C8:68:22:DC:9D:17:59:C7:23:A9:FE:0D:D7:8B:FB:E9:6F:56",
    "cert_not_after": "2026-11-15",
    "cert_key_algo": "EC",
    "cert_key_bits": 384,
    "cert_issuer": "DigiCert Global G3",
    "probe_tls_version": "TLS1.3",
    "probe_verify_ok": true,
    "probe_mtls_required": true,
    "probe_mtls_presented": false,
    "probe_chain_valid": true,
    "probe_http_status": 200,
    "probe_observed_fingerprint": "1F:DB:4A:C1:0F:11:1A:E5:20:47:E0:7E:65:10:C8:68:22:DC:9D:17:59:C7:23:A9:FE:0D:D7:8B:FB:E9:6F:56"
  },
  {
    "service_id": "svc-010",
    "service_name": "mariner-partner-api",
    "environment": "prod",
    "waiver_type": "mtls",
    "waiver_status": "granted",
    "waiver_scope": "staging",
    "waiver_expires_on": "2026-09-01",
    "cert_fingerprint": "A3:3A:A8:B6:FB:FB:C7:52:5A:DD:8D:67:8D:A5:47:1E:54:D0:B6:D3:B6:92:7F:76:7F:0B:FF:0D:D9:13:99:8E",
    "cert_not_after": "2026-12-10",
    "cert_key_algo": "RSA",
    "cert_key_bits": 2048,
    "cert_issuer": "Mariner Public CA R3",
    "probe_tls_version": "TLS1.2",
    "probe_verify_ok": true,
    "probe_mtls_required": true,
    "probe_mtls_presented": false,
    "probe_chain_valid": true,
    "probe_http_status": 200,
    "probe_observed_fingerprint": "A3:3A:A8:B6:FB:FB:C7:52:5A:DD:8D:67:8D:A5:47:1E:54:D0:B6:D3:B6:92:7F:76:7F:0B:FF:0D:D9:13:99:8E"
  },
  {
    "service_id": "svc-011",
    "service_name": "mariner-audit-log",
    "environment": "prod",
    "waiver_type": "none",
    "waiver_status": "none",
    "waiver_scope": null,
    "waiver_expires_on": null,
    "cert_fingerprint": "2F:81:2B:09:1B:AD:23:66:1A:AB:3F:AD:E1:63:30:CC:01:28:55:2C:C9:42:6C:AD:34:C7:F8:34:EA:DF:73:DA",
    "cert_not_after": "2026-11-25",
    "cert_key_algo": "RSA",
    "cert_key_bits": 2048,
    "cert_issuer": "Mariner Internal CA G2",
    "probe_tls_version": "TLS1.2",
    "probe_verify_ok": false,
    "probe_mtls_required": true,
    "probe_mtls_presented": true,
    "probe_chain_valid": false,
    "probe_http_status": 200,
    "probe_observed_fingerprint": "2F:81:2B:09:1B:AD:23:66:1A:AB:3F:AD:E1:63:30:CC:01:28:55:2C:C9:42:6C:AD:34:C7:F8:34:EA:DF:73:DA"
  },
  {
    "service_id": "svc-012",
    "service_name": "mariner-notifications",
    "environment": "prod",
    "waiver_type": "none",
    "waiver_status": "none",
    "waiver_scope": null,
    "waiver_expires_on": null,
    "cert_fingerprint": "67:4F:3D:37:82:F6:FD:DD:03:5D:41:59:53:B9:41:02:1F:67:C9:99:A9:85:90:C6:AA:D1:A8:C2:64:0A:96:AE",
    "cert_not_after": "2026-06-20",
    "cert_key_algo": "RSA",
    "cert_key_bits": 2048,
    "cert_issuer": "Mariner Internal CA G2",
    "probe_tls_version": "TLS1.2",
    "probe_verify_ok": true,
    "probe_mtls_required": true,
    "probe_mtls_presented": true,
    "probe_chain_valid": true,
    "probe_http_status": 200,
    "probe_observed_fingerprint": "67:4F:3D:37:82:F6:FD:DD:03:5D:41:59:53:B9:41:02:1F:67:C9:99:A9:85:90:C6:AA:D1:A8:C2:64:0A:96:AE"
  },
  {
    "service_id": "svc-013",
    "service_name": "mariner-staging-portal",
    "environment": "staging",
    "waiver_type": "none",
    "waiver_status": "none",
    "waiver_scope": null,
    "waiver_expires_on": null,